### ISSUE TITLE
PHPMailer fails to send 

### ISSUE THREAD

**Issue by Hhhha** [PHPMailer/PHPMailer#2550]
Please check these things before submitting your issue:

- [ ] *Read the error message* you're seeing - it often tells you what is wrong, and may contain useful links & instructions
- [ ] Make sure you're using the latest version of PHPMailer
- [ ] Check that your problem is not dealt with in [the troubleshooting guide](https://github.com/PHPMailer/PHPMailer/wiki/Troubleshooting), especially if you're having problems connecting to Gmail or GoDaddy
- [ ] Include sufficient code to reproduce your problem
- [ ] If you're having an SMTP issue, include the debug output generated with `SMTPDebug = 2` set
- [ ] If you have a question about how to use PHPMailer (rather than reporting a bug in it), tag a question on Stack Overflow with `phpmailer`, but [**search first**](http://stackoverflow.com/questions/tagged/phpmailer)!

# Problem description
I can run it on the local machine but not on the server;
I'm using swoole.

PHP 7.2.27 (cli)
swoole => 4.5.9

# Code to reproduce

# Debug output
2021-11-01 07:24:29	Connection: opening to ssl://hwsmtp.exmail.qq.com:465, timeout=300, options=array()
2021-11-01 07:24:31	Connection: opened
2021-11-01 07:25:31	SERVER -> CLIENT: 220 smtp.qq.com Esmtp QQ Mail Server
2021-11-01 07:25:31	CLIENT -> SERVER: EHLO 10-8-60-88
2021-11-01 07:25:31	SERVER -> CLIENT:
2021-11-01 07:25:31	SMTP ERROR: EHLO command failed:
2021-11-01 07:25:31	SMTP NOTICE: EOF caught while checking if connected
2021-11-01 07:25:31	Connection: closed
2021-11-01 07:25:31	SMTP Error: Could not authenticate.
2021-11-01 07:25:31	SMTP connect() failed. https://github.com/PHPMailer/PHPMailer/wiki/Troubleshooting

**Comment by Synchro** [comment]
This looks like the mail server is misbehaving, however `10-8-60-88` is a strange looking hostname to provide for an EHLO command. Try setting a fixed hostname with `$mail->Helo = 'myserver.example.com';`, using your hostname.

**Comment by Hhhha** [comment]
> 
> 
> This looks like the mail server is misbehaving, however `10-8-60-88` is a strange looking hostname to provide for an EHLO command. Try setting a fixed hostname with `$mail->Helo = 'myserver.example.com';`, using your hostname.

It still doesn't work
The error message is the same

**Comment by Synchro** [comment]
OK, just looks like you have a misbehaving mail server returning an unexpected empty EHLO response that is breaking SMTP state tracking.

**Comment by Hhhha** [comment]
> 
> 
> OK, just looks like you have a misbehaving mail server returning an unexpected empty EHLO response that is breaking SMTP state tracking.

The EHLO command was not sent

tcpdump:

`



09:26:19.632066 IP 10-8-60-88.50934 > hwsmtp.exmail.qq.com.urd: Flags [S], seq 94697084, win 64952, options [mss 1412,sackOK,TS val 663731506 ecr 0,nop,wscale 9], length 0
09:26:19.637756 IP hwsmtp.exmail.qq.com.urd > 10-8-60-88.50934: Flags [S.], seq 40605543, ack 94697085, win 14600, options [mss 1412,nop,nop,sackOK,nop,wscale 7], length 0
09:26:19.637796 IP 10-8-60-88.50934 > hwsmtp.exmail.qq.com.urd: Flags [.], ack 1, win 127, length 0
09:26:19.638397 IP 10-8-60-88.50934 > hwsmtp.exmail.qq.com.urd: Flags [P.], seq 1:319, ack 1, win 127, length 318
09:26:19.643425 IP hwsmtp.exmail.qq.com.urd > 10-8-60-88.50934: Flags [.], ack 319, win 123, length 0
09:26:19.644724 IP hwsmtp.exmail.qq.com.urd > 10-8-60-88.50934: Flags [P.], seq 1:3414, ack 319, win 123, length 3413
09:26:19.644756 IP 10-8-60-88.50934 > hwsmtp.exmail.qq.com.urd: Flags [.], ack 3414, win 123, length 0
09:26:19.645586 IP 10-8-60-88.50934 > hwsmtp.exmail.qq.com.urd: Flags [P.], seq 319:445, ack 3414, win 126, length 126
09:26:19.650719 IP hwsmtp.exmail.qq.com.urd > 10-8-60-88.50934: Flags [P.], seq 3414:3656, ack 445, win 123, length 242
09:26:19.650778 IP hwsmtp.exmail.qq.com.urd > 10-8-60-88.50934: Flags [P.], seq 3656:3723, ack 445, win 123, length 67
09:26:19.650832 IP 10-8-60-88.50934 > hwsmtp.exmail.qq.com.urd: Flags [.], ack 3723, win 126, length 0
09:27:19.657154 IP hwsmtp.exmail.qq.com.urd > 10-8-60-88.50934: Flags [F.], seq 3723, ack 445, win 123, length 0
09:27:19.697991 IP 10-8-60-88.50934 > hwsmtp.exmail.qq.com.urd: Flags [.], ack 3724, win 126, length 0
09:27:20.659018 IP 10-8-60-88.50934 > hwsmtp.exmail.qq.com.urd: Flags [P.], seq 445:476, ack 3724, win 126, length 31
09:27:20.659059 IP 10-8-60-88.50934 > hwsmtp.exmail.qq.com.urd: Flags [F.], seq 476, ack 3724, win 126, length 0
09:27:20.664412 IP hwsmtp.exmail.qq.com.urd > 10-8-60-88.50934: Flags [R], seq 40609267, win 0, length 0
09:27:20.664485 IP hwsmtp.exmail.qq.com.urd > 10-8-60-88.50934: Flags [R], seq 40609267, win 0, length 0
`

**Comment by Synchro** [comment]
Those are showing length values, so there is something there – can you make it show the data too?

**Comment by Hhhha** [comment]
> 
> 
> Those are showing length values, so there is something there – can you make it show the data too?

No, I'm using SSL.
I guess it's still in the buffer and hasn't been sent out.

**Comment by Hhhha** [comment]
I've used OpenSSL to simulate requests.No problem found.

**Comment by Synchro** [comment]
In that case I can only guess that there's an underlying PHP bug? PHPMailer just calls fwrite, and after that it's up to the runtime.

**Comment by Hhhha** [comment]
> 
> 
> In that case I can only guess that there's an underlying PHP bug? PHPMailer just calls fwrite, and after that it's up to the runtime.

It's not that it doesn't work all the time, and the common sense occasionally works. And this problem did not appear after I replaced other bags
